{
  "schema": "ibasho.cert/2",
  "specHash": "ab8d651f8635c66f6e8151f53924e43b01f7de605bc861aa67d21bdf7a4cc80b",
  "engine": {
    "version": "0.1.0"
  },
  "packs": {
    "tariffs": [
      {
        "id": "uk-cap-2026q4-electricity",
        "version": "0.1.0",
        "data": {
          "fuel": "electricity",
          "currency": "GBP",
          "validFrom": "2026-10-01",
          "validTo": "2026-12-31",
          "period": "year",
          "slabs": [
            {
              "uptoWh": null,
              "price": "26320"
            }
          ],
          "standingPerDay": "54830000",
          "standingWhenUnused": true
        }
      },
      {
        "id": "uk-cap-2026q4-gas",
        "version": "0.1.0",
        "data": {
          "fuel": "gas",
          "currency": "GBP",
          "validFrom": "2026-10-01",
          "validTo": "2026-12-31",
          "period": "year",
          "slabs": [
            {
              "uptoWh": null,
              "price": "7970"
            }
          ],
          "standingPerDay": "29680000",
          "standingWhenUnused": false
        }
      }
    ],
    "carbon": {
      "id": "carbon-sap10-2",
      "version": "0.1.0",
      "data": {
        "unit": "ug/Wh",
        "includesTD": false,
        "factors": {
          "electricity": [
            "163000",
            "160000",
            "153000",
            "143000",
            "132000",
            "120000",
            "111000",
            "112000",
            "122000",
            "136000",
            "151000",
            "163000"
          ],
          "gas": [
            "210000",
            "210000",
            "210000",
            "210000",
            "210000",
            "210000",
            "210000",
            "210000",
            "210000",
            "210000",
            "210000",
            "210000"
          ],
          "oil": [
            "298000",
            "298000",
            "298000",
            "298000",
            "298000",
            "298000",
            "298000",
            "298000",
            "298000",
            "298000",
            "298000",
            "298000"
          ],
          "lpg": [
            "241000",
            "241000",
            "241000",
            "241000",
            "241000",
            "241000",
            "241000",
            "241000",
            "241000",
            "241000",
            "241000",
            "241000"
          ]
        }
      }
    },
    "trajectory": {
      "id": "carbon-trajectory-flat-sap10-2",
      "version": "0.1.0",
      "data": {
        "unit": "ug/Wh",
        "firstYear": 2026,
        "years": 25,
        "factors": {
          "electricity": [
            "136000",
            "136000",
            "136000",
            "136000",
            "136000",
            "136000",
            "136000",
            "136000",
            "136000",
            "136000",
            "136000",
            "136000",
            "136000",
            "136000",
            "136000",
            "136000",
            "136000",
            "136000",
            "136000",
            "136000",
            "136000",
            "136000",
            "136000",
            "136000",
            "136000"
          ],
          "gas": [
            "210000",
            "210000",
            "210000",
            "210000",
            "210000",
            "210000",
            "210000",
            "210000",
            "210000",
            "210000",
            "210000",
            "210000",
            "210000",
            "210000",
            "210000",
            "210000",
            "210000",
            "210000",
            "210000",
            "210000",
            "210000",
            "210000",
            "210000",
            "210000",
            "210000"
          ],
          "oil": [
            "298000",
            "298000",
            "298000",
            "298000",
            "298000",
            "298000",
            "298000",
            "298000",
            "298000",
            "298000",
            "298000",
            "298000",
            "298000",
            "298000",
            "298000",
            "298000",
            "298000",
            "298000",
            "298000",
            "298000",
            "298000",
            "298000",
            "298000",
            "298000",
            "298000"
          ],
          "lpg": [
            "241000",
            "241000",
            "241000",
            "241000",
            "241000",
            "241000",
            "241000",
            "241000",
            "241000",
            "241000",
            "241000",
            "241000",
            "241000",
            "241000",
            "241000",
            "241000",
            "241000",
            "241000",
            "241000",
            "241000",
            "241000",
            "241000",
            "241000",
            "241000",
            "241000"
          ]
        }
      }
    },
    "grants": [
      {
        "id": "grant-bus",
        "version": "0.1.0",
        "data": {
          "validFrom": "2022-05-23",
          "validTo": "2028-03-31",
          "regions": ["GB-ENG", "GB-WLS"],
          "applied": [
            ["2", "750000000000"],
            ["3", "750000000000"],
            ["6", "750000000000"],
            ["7", "750000000000"]
          ]
        }
      }
    ],
    "rules": [
      {
        "id": "rules-uk",
        "version": "0.1.0",
        "data": {
          "rules": [
            {
              "id": "UK.DNO.HP.LOOPED",
              "jurisdiction": "GB",
              "measures": ["ashp", "gshp"],
              "scope": "measure",
              "when": {
                "cmp": "=",
                "left": {
                  "fact": "h.supply.looped"
                },
                "right": 1
              },
              "effect": {
                "kind": "check",
                "check": "dno-approval"
              },
              "effectiveFrom": "2019-04-01",
              "source": {
                "url": "https://www.energynetworks.org/",
                "clause": "ENA heat pump connect and notify; looped service (DEC SC-3, reviewer memory)",
                "grade": "secondary"
              },
              "explain": "rules.uk.dno.hp.looped.explain"
            }
          ]
        }
      }
    ],
    "value": {
      "id": "value-uk-oo-v1",
      "version": "0.1.0",
      "data": {
        "uplift": {
          "A>C": {
            "low": "-2/127",
            "central": "-5/207",
            "high": "-13/220"
          },
          "A>D": {
            "low": "-2/127",
            "central": "-7/207",
            "high": "-1/11"
          },
          "A>E": {
            "low": "-2/127",
            "central": "-1/23",
            "high": "-7/55"
          },
          "A>F": {
            "low": "-15/508",
            "central": "-13/207",
            "high": "-1/5"
          },
          "A>G": {
            "low": "-15/508",
            "central": "-17/207",
            "high": "-5/22"
          },
          "B>C": {
            "low": "-2/127",
            "central": "-5/207",
            "high": "-13/220"
          },
          "B>D": {
            "low": "-2/127",
            "central": "-7/207",
            "high": "-1/11"
          },
          "B>E": {
            "low": "-2/127",
            "central": "-1/23",
            "high": "-7/55"
          },
          "B>F": {
            "low": "-15/508",
            "central": "-13/207",
            "high": "-1/5"
          },
          "B>G": {
            "low": "-15/508",
            "central": "-17/207",
            "high": "-5/22"
          },
          "C>A": {
            "low": "2/125",
            "central": "5/202",
            "high": "13/207"
          },
          "C>B": {
            "low": "2/125",
            "central": "5/202",
            "high": "13/207"
          },
          "C>D": {
            "low": "0",
            "central": "-1/101",
            "high": "-7/207"
          },
          "C>E": {
            "low": "0",
            "central": "-2/101",
            "high": "-5/69"
          },
          "C>F": {
            "low": "-7/500",
            "central": "-4/101",
            "high": "-31/207"
          },
          "C>G": {
            "low": "-7/500",
            "central": "-6/101",
            "high": "-37/207"
          },
          "D>A": {
            "low": "2/125",
            "central": "7/200",
            "high": "1/10"
          },
          "D>B": {
            "low": "2/125",
            "central": "7/200",
            "high": "1/10"
          },
          "D>C": {
            "low": "0",
            "central": "1/100",
            "high": "7/200"
          },
          "D>E": {
            "low": "0",
            "central": "-1/100",
            "high": "-1/25"
          },
          "D>F": {
            "low": "-7/500",
            "central": "-3/100",
            "high": "-3/25"
          },
          "D>G": {
            "low": "-7/500",
            "central": "-1/20",
            "high": "-3/20"
          },
          "E>A": {
            "low": "2/125",
            "central": "1/22",
            "high": "7/48"
          },
          "E>B": {
            "low": "2/125",
            "central": "1/22",
            "high": "7/48"
          },
          "E>C": {
            "low": "0",
            "central": "2/99",
            "high": "5/64"
          },
          "E>D": {
            "low": "0",
            "central": "1/99",
            "high": "1/24"
          },
          "E>F": {
            "low": "-7/500",
            "central": "-2/99",
            "high": "-1/12"
          },
          "E>G": {
            "low": "-7/500",
            "central": "-4/99",
            "high": "-11/96"
          },
          "F>A": {
            "low": "15/493",